{
  "appealWindowSec": 1500,
  "backupWindowSec": 600,
  "blockNumber": 48179681,
  "broadcast": true,
  "canonical": true,
  "chainId": 84532,
  "challengeWindowSec": 600,
  "digest": "0x39101eb8db3ea147c8278e60c5b4fa7b1d7ee9f9d0b2a31571f1371df7cfe159",
  "doNotPin": false,
  "eas": "0x4200000000000000000000000000000000000021",
  "emergencyReviewWindowSec": 1500,
  "escalationAttester": "0xC5b574B6D86cb07B642A0Df3bB230b2959E390F0",
  "escalationCohortId": 2,
  "escalationDisabledAt": 0,
  "escalationEnabled": true,
  "factory": "0xA31938E1a57E569E1d34F55E7F7A92BE1467c6d7",
  "implementation": "0x0A6811Ba19C56dcAA95C4337364CB09d7B3cCBEc",
  "implementationCodehash": "0xbd51ba2e486cafcca85e4fd374ba5065792c8afc77275f94ed3a163efedcff5e",
  "label": "",
  "library": "0xd31781445E85414c14062c92E06E5b030BbdE4af",
  "libraryCodehash": "0xfc7a20bc9191d2d06e712cbbcb415443ef3c885b057fbd789949cb010e54c49c",
  "maxReclaimDelaySec": 31536000,
  "minReclaimDelaySec": 4500,
  "mode": "CANONICAL",
  "o5SchemaUid": "0x8db45d13a10c91fb78ea23fe354c2f672c9a50c1b071fd3da6132b0d9e3bb6bd",
  "o5TypeHash": "0xb1655a362b95f8aff16b8e0d088e7316643950f91bd955d8dd5b98092b140872",
  "optimizer": "enabled, runs=200",
  "primaryAttester": "0x35E4bc5853c2c11721F9CC864bf154dfbc00afBE",
  "primaryCohortId": 1,
  "primaryDisabledAt": 0,
  "primaryEnabled": true,
  "provisionalTagOnChain": "n/a",
  "quorumFloor": 1,
  "reverify": "FOUNDRY_PROFILE=testnet forge script script/DeployVNextSettlement.s.sol --sig 'verify(address)' <factory>",
  "routeDiversityRule": "GATE 1: signerSetIntersection < quorumFloor = min(primaryThreshold, escalationThreshold). Re-derivable from chain state with --sig 'verify(address)'; these fields are NOT in `digest`.",
  "scheduleId": "vnext-testnet-short-v1",
  "scheduleTestnetOnly": true,
  "signerOverlapExplicitlyAllowed": false,
  "signerSetIntersection": 0,
  "signerSetsFullyDisjoint": true,
  "solc": "0.8.24",
  "specVersion": 2,
  "usdc": "0x036CbD53842c5426634e7929541eC2318f3dCF7e"
}