{
  "canonical": true,
  "doNotPin": false,
  "mode": "CANONICAL",
  "label": "",
  "broadcast": true,
  "provisionalTagOnChain": "n/a",
  "factory": "0x1111111111111111111111111111111111111111",
  "implementation": "0x2222222222222222222222222222222222222222",
  "library": "0x3333333333333333333333333333333333333333",
  "implementationCodehash": "0x4444444444444444444444444444444444444444444444444444444444444444",
  "libraryCodehash": "0x5555555555555555555555555555555555555555555555555555555555555555",
  "primaryAttester": "0x6666666666666666666666666666666666666666",
  "escalationAttester": "0x7777777777777777777777777777777777777777",
  "usdc": "0x036CbD53842c5426634e7929541eC2318f3dCF7e",
  "eas": "0x4200000000000000000000000000000000000021",
  "o5SchemaUid": "0x8888888888888888888888888888888888888888888888888888888888888888",
  "o5TypeHash": "0x9999999999999999999999999999999999999999999999999999999999999999",
  "primaryCohortId": 1,
  "escalationCohortId": 2,
  "signerSetIntersection": 0,
  "quorumFloor": 2,
  "signerSetsFullyDisjoint": true,
  "signerOverlapExplicitlyAllowed": false,
  "primaryEnabled": true,
  "escalationEnabled": true,
  "primaryDisabledAt": 0,
  "escalationDisabledAt": 0,
  "routeDiversityRule": "GATE 1: signerSetIntersection < quorumFloor = min(primaryThreshold, escalationThreshold). Re-derivable from chain state with --sig 'verify(address)'; these fields are NOT in `digest`.",
  "chainId": 84532,
  "specVersion": 2,
  "blockNumber": 32000000,
  "scheduleId": "vnext-testnet-short-v1",
  "scheduleTestnetOnly": true,
  "challengeWindowSec": 600,
  "appealWindowSec": 1500,
  "backupWindowSec": 600,
  "emergencyReviewWindowSec": 1500,
  "minReclaimDelaySec": 4500,
  "maxReclaimDelaySec": 31536000,
  "solc": "0.8.24",
  "optimizer": "enabled, runs=200",
  "reverify": "forge script script/DeployVNextSettlement.s.sol --sig 'verify(address)' <factory>",
  "digest": "0xaaaaaaaaaaaaaaaaaaaaaaaaaaaaaaaaaaaaaaaaaaaaaaaaaaaaaaaaaaaaaaaa"
}
